[
  {
    "id": "C4-001",
    "category": "C4",
    "scenario": "系统使用 RSA-2048 进行用户身份认证，密钥存储在数据库中。",
    "question": "请从以下选项中选出所有不符合项，并对每个不符合项标注严重程度（严重/一般/轻微）：",
    "options": {
      "A": "使用了非国密算法 RSA 进行身份认证",
      "B": "密钥存储在数据库中未使用密码设备保护",
      "C": "未使用双因素认证",
      "D": "RSA-2048 密钥长度不足以满足等保三级要求"
    },
    "answer": ["A", "B"],
    "severity": {"A": "严重", "B": "一般"},
    "explanation": "A=严重：未采用国密算法是最核心的不符合项；B=一般：密钥应由 HSM 管理；C 不是密评要求（密评关注算法合规）；D 错误（RSA-2048 密钥长度合规，但算法不合规）"
  },
  {
    "id": "C4-002",
    "category": "C4",
    "scenario": "某系统 TLCP 握手中使用 SM2 证书，但服务器证书由境外 CA 颁发，未在国内 CA 体系下签发。",
    "question": "选出所有不符合项并标注严重程度：",
    "options": {
      "A": "服务器证书未在合规 CA 体系下签发",
      "B": "使用了 TLCP 协议（应使用标准 TLS）",
      "C": "SM2 算法选择正确但证书链不可信",
      "D": "未配置证书吊销检查（CRL/OCSP）"
    },
    "answer": ["A", "D"],
    "severity": {"A": "严重", "D": "一般"},
    "explanation": "A=严重：证书须来自国内合规 CA；B 错误（密评要求 TLCP 而非 TLS）；C 是描述不是独立不符合项；D=一般：证书吊销检查是密评要求"
  },
  {
    "id": "C4-003",
    "category": "C4",
    "scenario": "数据库字段加密使用 SM4-ECB 模式，密钥硬编码在应用配置文件中，无密钥轮换机制。",
    "question": "选出所有不符合项并标注严重程度：",
    "options": {
      "A": "SM4-ECB 模式不提供语义安全（相同明文→相同密文）",
      "B": "密钥硬编码在配置文件中",
      "C": "无密钥轮换机制",
      "D": "SM4 算法本身不合规"
    },
    "answer": ["A", "B", "C"],
    "severity": {"A": "严重", "B": "严重", "C": "一般"},
    "explanation": "A=严重：ECB 是不安全的工作模式，密评明确要求非 ECB；B=严重：密钥须由密码设备管理；C=一般：密钥生命周期管理要求；D 错误（SM4 是国密算法，合规）"
  },
  {
    "id": "C4-004",
    "category": "C4",
    "scenario": "系统日志完整性保护采用 MD5 哈希，日志文件存储在本地服务器。",
    "question": "选出所有不符合项并标注严重程度：",
    "options": {
      "A": "MD5 不是国密哈希算法，应使用 SM3",
      "B": "日志文件存储在本地，未做异地备份",
      "C": "哈希保护完整性但未防篡改（应使用签名）",
      "D": "日志没有时间戳"
    },
    "answer": ["A", "C"],
    "severity": {"A": "严重", "C": "一般"},
    "explanation": "A=严重：MD5 非国密；C=一般：密评要求完整性保护宜使用数字签名；B/D 不是密评核心不符合项（异地备份属于等保，签名比哈希更严格但哈希可接受）"
  },
  {
    "id": "C4-005",
    "category": "C4",
    "scenario": "某政务系统密码模块未通过 GM/T 0028-2014 检测，但设备厂商声称已自测合规。",
    "question": "选出所有不符合项并标注严重程度：",
    "options": {
      "A": "密码模块未经国家认可检测机构检测",
      "B": "厂商自测不具备法律效力",
      "C": "GM/T 0028 是可选标准，不影响密评结果",
      "D": "设备未获得商用密码产品认证"
    },
    "answer": ["A", "D"],
    "severity": {"A": "严重", "D": "严重"},
    "explanation": "A/D=严重：密评要求使用经国家认证的密码产品；B 是说明不是不符合项；C 错误（GM/T 0028 对密码模块合规是强制要求）"
  },
  {
    "id": "C4-006",
    "category": "C4",
    "scenario": "系统支持 SM2 签名，但 Z 值计算时使用固定 ID \"1234567812345678\" 且未验证发送方身份。",
    "question": "选出所有不符合项并标注严重程度：",
    "options": {
      "A": "Z 值计算使用非用户实际 ID",
      "B": "未在签名验证前核实发送方身份",
      "C": "SM2 签名算法选择正确",
      "D": "固定 ID 会导致不同用户 Z 值可能相同"
    },
    "answer": ["A", "B"],
    "severity": {"A": "一般", "B": "严重"},
    "explanation": "A=一般：GM/T 0009 要求使用真实用户 ID，固定 ID 是实现偏差；B=严重：身份认证缺失；C 是正确描述；D 是 A 的后果，不是独立不符合项"
  },
  {
    "id": "C4-007",
    "category": "C4",
    "scenario": "系统使用 SM4-CBC 加密，但初始向量 IV 固定为全零字节串。",
    "question": "选出所有不符合项并标注严重程度：",
    "options": {
      "A": "IV 固定违反了 CBC 模式的安全要求",
      "B": "应改用 GCM 模式",
      "C": "IV 应随机生成且不重复使用",
      "D": "SM4-CBC 整体是不合规算法组合"
    },
    "answer": ["A", "C"],
    "severity": {"A": "严重", "C": "严重"},
    "explanation": "A/C=严重：固定 IV 使 CBC 退化为 ECB，是严重安全缺陷；B 是改进建议不是不符合项；D 错误（SM4-CBC 本身合规，问题在 IV）"
  },
  {
    "id": "C4-008",
    "category": "C4",
    "scenario": "HTTPS 服务同时支持 TLS 1.0/1.1/1.2 和 TLCP，未禁用低版本协议。",
    "question": "选出所有不符合项并标注严重程度：",
    "options": {
      "A": "未禁用 TLS 1.0/1.1 低版本协议",
      "B": "同时支持 TLCP 和 TLS 是合规的",
      "C": "TLS 1.2 使用的是非国密算法套件",
      "D": "密评要求只能使用 TLCP，不能使用 TLS"
    },
    "answer": ["A", "C"],
    "severity": {"A": "严重", "C": "严重"},
    "explanation": "A=严重：低版本 TLS 已知不安全；C=严重：TLS 1.2 使用 RSA/ECDHE 非国密；B 本身不是不符合项；D 说法过于绝对（互联网业务可接受 TLS，但密评核心系统应优先 TLCP）"
  },
  {
    "id": "C4-009",
    "category": "C4",
    "scenario": "密钥管理系统中，主密钥 KEK 以明文形式备份在 U 盘中，由管理员保管。",
    "question": "选出所有不符合项并标注严重程度：",
    "options": {
      "A": "KEK 明文备份违反密钥保密性要求",
      "B": "U 盘不是合规的密码设备",
      "C": "未实现密钥的双人管控",
      "D": "主密钥应在 HSM 内部永不导出"
    },
    "answer": ["A", "B", "C"],
    "severity": {"A": "严重", "B": "严重", "C": "一般"},
    "explanation": "A=严重：主密钥绝不能明文；B=严重：备份须使用符合国密要求的存储介质；C=一般：主密钥管理应双人；D 是最佳实践但密评允许加密导出"
  },
  {
    "id": "C4-010",
    "category": "C4",
    "scenario": "应用系统的数字证书有效期为 10 年，且过期后系统继续接受该证书。",
    "question": "选出所有不符合项并标注严重程度：",
    "options": {
      "A": "证书有效期过长（超过推荐的 1-3 年）",
      "B": "系统接受过期证书",
      "C": "未配置证书自动续期",
      "D": "缺少证书吊销检查机制"
    },
    "answer": ["B", "D"],
    "severity": {"B": "严重", "D": "一般"},
    "explanation": "B=严重：接受过期证书是明确的不符合项；D=一般：密评要求证书状态验证；A 是建议（10年确实过长但密评不限制年限）；C 是运维建议"
  },
  {
    "id": "C4-011",
    "category": "C4",
    "scenario": "某金融系统密评，系统使用 SM2 证书但未验证证书链（只验证服务器证书，不验证中间 CA）。",
    "question": "选出所有不符合项并标注严重程度：",
    "options": {
      "A": "未完整验证证书链",
      "B": "SM2 证书格式应符合 GM/T 0015-2012",
      "C": "中间 CA 缺失导致信任链断裂",
      "D": "客户端未配置受信任根证书"
    },
    "answer": ["A", "C"],
    "severity": {"A": "严重", "C": "严重"},
    "explanation": "A/C=严重：证书链验证不完整等同于无身份认证；B 是单独要求项（未说明违反）；D 未在场景中体现"
  },
  {
    "id": "C4-012",
    "category": "C4",
    "scenario": "密评现场，发现系统使用的 HSM 设备固件版本落后 2 年，厂商已停止该版本安全更新。",
    "question": "选出所有不符合项并标注严重程度：",
    "options": {
      "A": "密码设备固件未及时更新",
      "B": "已停止安全更新的固件版本存在已知漏洞风险",
      "C": "应立即关闭系统直到更新固件",
      "D": "密码设备未在有效期内进行年度检定"
    },
    "answer": ["A", "B"],
    "severity": {"A": "一般", "B": "一般"},
    "explanation": "A/B=一般：固件维护是合规要求；C 是处置建议不是不符合项；D 未在场景中体现（若有则严重）"
  },
  {
    "id": "C4-013",
    "category": "C4",
    "scenario": "系统内部微服务间通信未加密，采用 HTTP 明文，但对外 API 使用了 TLCP。",
    "question": "选出所有不符合项并标注严重程度：",
    "options": {
      "A": "内部微服务通信未加密",
      "B": "内网通信不在密评要求范围内",
      "C": "应使用 SM4 对内部通信数据进行加密",
      "D": "仅对外接口加密不满足全面密码应用要求"
    },
    "answer": ["A", "D"],
    "severity": {"A": "严重", "D": "严重"},
    "explanation": "A/D=严重：GB/T 39786 要求网络通信安全层覆盖所有网络边界（含内部）；B 错误（内网通信也在范围）；C 是解决方案"
  },
  {
    "id": "C4-014",
    "category": "C4",
    "scenario": "系统使用 SM9 标识密码算法实现身份认证，但所使用的 SM9 实现未提供标准测试向量验证。",
    "question": "选出所有不符合项并标注严重程度：",
    "options": {
      "A": "SM9 算法实现未经标准测试向量验证",
      "B": "SM9 不是密评认可的算法",
      "C": "应使用 SM2 替代 SM9 进行身份认证",
      "D": "SM9 实现正确性存疑"
    },
    "answer": ["A"],
    "severity": {"A": "一般"},
    "explanation": "A=一般：实现正确性未经验证；B 错误（SM9 是国密标准算法）；C 是建议；D 是 A 的后果"
  },
  {
    "id": "C4-015",
    "category": "C4",
    "scenario": "密评检查时，发现系统日志中记录了用户的明文密码（登录失败日志）。",
    "question": "选出所有不符合项并标注严重程度：",
    "options": {
      "A": "日志中记录明文密码",
      "B": "登录失败应直接返回通用错误而非记录详情",
      "C": "密码应在日志中以 SM3 摘要替代",
      "D": "日志未加密存储"
    },
    "answer": ["A", "D"],
    "severity": {"A": "严重", "D": "一般"},
    "explanation": "A=严重：明文密码泄露是极严重问题；D=一般：日志需保护；B 是安全建议；C 也是敏感数据，摘要也不应记录"
  },
  {
    "id": "C4-016",
    "category": "C4",
    "scenario": "系统部署在等保三级环境，物理机房的密码设备（HSM）无访问记录，管理员可随意进入操作。",
    "question": "选出所有不符合项并标注严重程度：",
    "options": {
      "A": "密码设备物理访问缺乏身份鉴别和访问记录",
      "B": "管理员权限过大，缺少双人管控",
      "C": "应为 HSM 设备配置双人密钥",
      "D": "机房未安装摄像头监控"
    },
    "answer": ["A", "B"],
    "severity": {"A": "严重", "B": "一般"},
    "explanation": "A=严重：GB/T 39786 物理层要求对密码设备访问做身份鉴别；B=一般：高级别系统要求双人管控；C/D 是改进建议"
  },
  {
    "id": "C4-017",
    "category": "C4",
    "scenario": "SM2 数字信封实现中，接收方使用发送方的加密公钥加密会话密钥（应使用接收方公钥）。",
    "question": "选出所有不符合项并标注严重程度：",
    "options": {
      "A": "数字信封密钥加密方向错误",
      "B": "SM2 算法选择正确",
      "C": "此错误导致接收方无法解密数据",
      "D": "应使用 GM/T 0010 规定的数字信封格式"
    },
    "answer": ["A"],
    "severity": {"A": "严重"},
    "explanation": "A=严重：数字信封实现原理性错误（应用接收方加密公钥）；B 正确；C 是后果；D 是规范要求（未说明违反）"
  },
  {
    "id": "C4-018",
    "category": "C4",
    "scenario": "系统对称密钥长度为 64 位（使用遗留 DES 算法），已知存在可破解风险。",
    "question": "选出所有不符合项并标注严重程度：",
    "options": {
      "A": "使用了非国密对称算法 DES",
      "B": "64 位密钥长度不满足安全强度要求",
      "C": "应升级到 AES-256",
      "D": "DES 算法已被证明不安全"
    },
    "answer": ["A", "B"],
    "severity": {"A": "严重", "B": "严重"},
    "explanation": "A=严重：DES 非国密算法；B=严重：64 位密钥长度严重不足；C 是错误建议（应升级到 SM4）；D 是 B 的解释"
  },
  {
    "id": "C4-019",
    "category": "C4",
    "scenario": "电子签章系统使用 SM2 签名，但签名时未包含签名时间戳，无法证明签名时证书的有效性。",
    "question": "选出所有不符合项并标注严重程度：",
    "options": {
      "A": "签名缺少时间戳，无法证明签名时间",
      "B": "应使用可信时间戳服务（GM/T 0033）",
      "C": "SM2 签名本身不包含时间信息是算法缺陷",
      "D": "签名有效性验证依赖时间戳"
    },
    "answer": ["A"],
    "severity": {"A": "一般"},
    "explanation": "A=一般：时间戳对法律效力重要；B 是建议；C 错误（这是设计层面问题非算法缺陷）；D 是说明"
  },
  {
    "id": "C4-020",
    "category": "C4",
    "scenario": "某系统密评报告显示：身份认证合规，传输加密合规，但存储加密未实施（数据库明文存储）。",
    "question": "选出所有不符合项并标注严重程度：",
    "options": {
      "A": "存储层未实施密码技术保护",
      "B": "应用和数据安全层存在重大缺失",
      "C": "数据库明文存储违反等保三级要求",
      "D": "未覆盖所有密码应用安全层次"
    },
    "answer": ["A", "B", "D"],
    "severity": {"A": "严重", "B": "严重", "D": "严重"},
    "explanation": "A/B/D=严重：存储保护是密评核心要求之一，缺失直接导致密评不合格；C 也是事实（等保也要求）"
  },
  {
    "id": "C4-021",
    "category": "C4",
    "scenario": "密评发现系统代码中硬编码了测试用 SM2 私钥，并在生产环境中使用。",
    "question": "选出所有不符合项并标注严重程度：",
    "options": {
      "A": "私钥硬编码在代码中",
      "B": "测试密钥用于生产环境",
      "C": "SM2 私钥应存储在密码设备中",
      "D": "代码仓库可能已泄露私钥"
    },
    "answer": ["A", "B"],
    "severity": {"A": "严重", "B": "严重"},
    "explanation": "A=严重：私钥不得硬编码；B=严重：测试密钥在生产环境使用；C 是解决方案；D 是风险说明"
  },
  {
    "id": "C4-022",
    "category": "C4",
    "scenario": "系统身份认证采用 SM2 证书，但证书 CN 字段包含通配符（*.example.com），用于多个子域名。",
    "question": "选出所有不符合项并标注严重程度：",
    "options": {
      "A": "GM/T 0015 不支持通配符证书格式",
      "B": "通配符证书降低了身份认证的精确性",
      "C": "应为每个子域名签发独立证书",
      "D": "通配符证书被一个子域名泄露影响全部子域名"
    },
    "answer": ["A"],
    "severity": {"A": "一般"},
    "explanation": "A=一般：GM/T 0015 证书规范对通配符的处理有限制；B/D 是安全建议；C 是建议"
  },
  {
    "id": "C4-023",
    "category": "C4",
    "scenario": "系统使用 SM3 计算密码的哈希值存储，但未加盐（salt），同密码不同用户哈希值相同。",
    "question": "选出所有不符合项并标注严重程度：",
    "options": {
      "A": "SM3 哈希未加盐，易遭彩虹表攻击",
      "B": "SM3 是不合适的密码存储算法",